{
  "$schema": "https://json-schema.org/draft/2020-12/schema",
  "$id": "https://airprompter.com/protocol/0.1/bundle.schema.json",
  "title": "AirPrompter offline bundle (.apbundle)",
  "description": "An offline update is the OTA release, serialized (D37): the signed manifest, every payload it references, and the current key-set, with a signed `notAfter`. The file travels by USB stick, artifact repository or email, so it is encrypted to the target's distribution public key (HPKE, D56). A plaintext bundle is a `dev`-target opt-in and never the default. `apply` runs the identical verification path as OTA.",
  "type": "object",
  "additionalProperties": false,
  "required": ["format", "version", "protocol", "encryption"],
  "properties": {
    "format": { "const": "apbundle" },
    "version": { "const": 1 },
    "protocol": { "$ref": "manifest.schema.json#/$defs/protocolVersion" },
    "encryption": {
      "oneOf": [
        {
          "title": "Encrypted (default)",
          "type": "object",
          "additionalProperties": false,
          "required": ["scheme", "recipientKeyId", "enc", "ciphertext"],
          "properties": {
            "scheme": { "const": "hpke-x25519-hkdf-sha256-aes-256-gcm" },
            "recipientKeyId": {
              "description": "keyId of the target's distribution public key (registered in the console; generated by `airprompter keygen`).",
              "$ref": "manifest.schema.json#/$defs/keyId"
            },
            "enc": {
              "description": "HPKE encapsulated key (RFC 9180 base mode), base64url without padding.",
              "$ref": "manifest.schema.json#/$defs/base64url"
            },
            "info": {
              "description": "HPKE info string. Fixed to `airprompter-apbundle-v1`.",
              "const": "airprompter-apbundle-v1"
            },
            "ciphertext": {
              "description": "AEAD ciphertext of the UTF-8 canonical JSON of the `contents` document, base64url without padding. AAD is the UTF-8 string `<agentId>|<target>` — both known to the recipient before decryption — so a bundle cannot be re-labelled for another agent or target; the generation check happens after decryption, on the manifest.",
              "$ref": "manifest.schema.json#/$defs/base64url"
            }
          }
        },
        {
          "title": "Plaintext (dev opt-in, `--plaintext`)",
          "type": "object",
          "additionalProperties": false,
          "required": ["scheme", "contents"],
          "properties": {
            "scheme": { "const": "none" },
            "contents": { "$ref": "#/$defs/contents" }
          }
        }
      ]
    }
  },
  "$defs": {
    "contents": {
      "type": "object",
      "additionalProperties": false,
      "required": ["createdAt", "notAfter", "manifest", "keySet", "payloads"],
      "properties": {
        "createdAt": { "$ref": "manifest.schema.json#/$defs/timestamp" },
        "notAfter": {
          "description": "Offline lease. After it the runtime is `lease_expired` and follows the target's degrade/halt setting. Bound by the manifest's issuedAt + leaseSeconds unless the target is `syncMode: offline`.",
          "$ref": "manifest.schema.json#/$defs/timestamp"
        },
        "manifest": { "$ref": "manifest.schema.json" },
        "keySet": {
          "description": "The platform root metadata current when the bundle was pulled; verified against the pinned root exactly as over the air.",
          "$ref": "key-set.schema.json"
        },
        "countersignKeySet": {
          "description": "Present on countersign targets so an air-gapped host can verify the countersignatures.",
          "$ref": "key-set.schema.json"
        },
        "payloads": {
          "description": "Every content hash the manifest references (slots, steps, arm overrides), each exactly once.",
          "type": "array",
          "minItems": 1,
          "maxItems": 1024,
          "items": {
            "type": "object",
            "additionalProperties": false,
            "required": ["contentHash", "byteLength", "bytes"],
            "properties": {
              "contentHash": { "$ref": "manifest.schema.json#/$defs/sha256" },
              "byteLength": { "type": "integer", "minimum": 0, "maximum": 65536 },
              "bytes": {
                "description": "The payload bytes, base64url without padding. sha256 of the decoded bytes must equal contentHash.",
                "type": "string",
                "pattern": "^[A-Za-z0-9_-]*$"
              }
            }
          }
        }
      }
    }
  }
}
